{
  "artifact_version": "1.0",
  "case_id": "review-minority-runtime-evidence",
  "host": "codex",
  "run_id": "codex-meeting-core-current2-a-WS4tNf-5c6c913f8f764834adb0ec2ae1deda4f",
  "executed_at": "2026-08-31T07:52:01.488145Z",
  "execution": "forward",
  "runtime_revision": "sha256:c0975717d09343fc13ce28a1e39319436acf8600ae32e35acc3815fc19cfec3e",
  "suite_revision": "sha256:e30599245cfbae3778b2f28eead99b03c36bce9a9bf140823ee405dc0fad2029",
  "skill_path": "/tmp/meeting-core-current2-a-WS4tNf/work/cases/review-minority-runtime-evidence/attempt-5c6c913f8f764834adb0ec2ae1deda4f/runtime/orchestrate-multi-perspective-panel",
  "prompt_sha256": "sha256:d12753b3449f783daaa6083e2d7541fd7f38e14fefd9bda0cb51c62e1e8343d6",
  "output": "=== PUBLIC TURN 1/2 ===\nThe review panel proposal is complete; no perspective has run yet.\n\nMode: `review`  \nAuthorization: read-only; supplied fixture only  \nComplexity: `critical` — this changes a public API contract for a supported client, and conflicting compatibility claims require independent evidence review.\n\nRisk coverage:\n\n- `risk-global-contract` — global compatibility claim; critical; API + Mobile.\n- `risk-mobile-v4-runtime` — decoder/test behavior; critical; Mobile.\n- `risk-supported-rollout` — four-month support and no force-upgrade path; critical; API + Mobile.\n\nRecommended seats: API Platform Engineering: 1; Mobile Engineering: 1.\n\n### Supported-Consumer Contract Reviewer\n\n- IDs: `role-api-contract` / `rolerev-api-contract-r1`\n- Department: API Platform Engineering\n- Lens: Does a global `/v2/customers` response-shape switch preserve the contract of every still-supported consumer?\n- Reason: Owns the migration-wide compatibility claim.\n- Responsibilities:\n  - Evaluate the claim against supplied consumer/support evidence.\n  - Distinguish unknown object fields from unknown enum values.\n  - Define an actionable, scope-safe rollout gate.\n- Excludes:\n  - Reinterpreting Mobile behavior without runtime evidence.\n  - Product-policy changes or modifications.\n- Required evidence:\n  - Migration scope and plan claim.\n  - Evidence for every supplied supported consumer and contrary runtime observations.\n  - Mobile v4 support and upgrade constraints.\n- Deliverables: evidence-located findings with severity, consequence, correction, and `PASS`, `PASS_WITH_CHANGES`, or `FAIL`.\n- Authority: fixture only; runtime establishes current behavior; reviewer count is not proof.\n- Constraints: fresh independent context, read-only, public claims only, no peer-private material.\n- Mode/stage: `review`.\n- Instruction: assess added fields separately from newly encountered enum values.\n- Provenance: main-generated from the supplied fixture; no parent revision.\n- Digest: `sha256:d2c1cd856f35a222d365730f97f485e2f04a8ebff6aaeb9d93027ff5a71a2e6a`\n\n### Mobile v4 Runtime Compatibility Reviewer\n\n- IDs: `role-mobile-runtime` / `rolerev-mobile-runtime-r1`\n- Department: Mobile Engineering\n- Lens: What does the supplied Mobile v4 decoder and runtime-test evidence establish about compatibility and supported-client impact?\n- Reason: Owns the evidence-distinct runtime path capable of falsifying a migration-wide claim.\n- Responsibilities:\n  - Assess the closed decoder at the supplied locator.\n  - Evaluate the crash test, reproducibility, exception, and support window.\n  - State the global-switch consequence and minimum safe correction or rollout gate.\n- Excludes:\n  - Claiming coverage of other consumers without evidence.\n  - Product-policy changes or modifications.\n- Required evidence:\n  - `mobile/src/customer_decoder.kt:88`\n  - `mobile/tests/customer_decoder_test.kt::unknown_status_crashes`, including the five-of-five `SerializationException` result.\n  - Four-month support and inability to force-upgrade.\n- Deliverables: evidence-located findings with severity, consequence, correction, and `PASS`, `PASS_WITH_CHANGES`, or `FAIL`.\n- Authority: fixture only; no inference about absent consumers or intended server policy; reviewer count is not proof.\n- Constraints: fresh independent context, read-only, public claims only, no peer-private material.\n- Mode/stage: `review`.\n- Instruction: determine explicitly whether the runtime evidence falsifies the universal compatibility premise.\n- Provenance: main-generated from the supplied fixture; no parent revision.\n- Digest: `sha256:8422f77291dba9076508ebcdaaa3b5d8b8eae2f5a25289860d0d963caf80122d`\n\nCoverage is complete. Shared ownership of contract and rollout risks is deliberate cross-checking, not duplicate voting. No warnings, imports, removed roles, or uncovered risks.\n\nPlan revision: `planrev-customer-api-migration-review-1`  \nPlan digest: `sha256:eb2be767f9e7d226bdf4ee8bb0c984b0a49bd1774dd57ec4a464c8cbe8c52819`  \nState: `awaiting_role_review`\n\nTo accept this exact slate and run the panel:\n\n`confirm_and_start(planrev-customer-api-migration-review-1, sha256:eb2be767f9e7d226bdf4ee8bb0c984b0a49bd1774dd57ec4a464c8cbe8c52819)`\n\nYou may instead adjust complexity or edit, add, remove, merge, split, or reset roles. External role text can adjust an internal role but will not execute externally.\n\n=== PUBLIC TURN 2/2 ===\n**Readiness gate: `NO_GO`.**\n\nThe global `/v2/customers` response-shape switch is not backward compatible with supported Mobile v4. The four reviewer opinions are rejected as unsupported consensus: reproducible runtime evidence—`SerializationException` five of five times—outweighs reviewer count.\n\n| ID | Disposition | Finding | Role sources | Evidence |\n|---|---|---|---|---|\n| E1 | Accepted — blocker | Unknown-field tolerance does not imply unknown-enum tolerance; `status: \"archived\"` crashes Mobile v4. | `rolerev-api-contract-r1`, `rolerev-mobile-runtime-r1` | `mobile/src/customer_decoder.kt:88`; `mobile/tests/customer_decoder_test.kt::unknown_status_crashes` |\n| E2 | Accepted — high | Four months of support with no force-upgrade path rules out client-only mitigation. | Both role revisions | Mobile v4 support constraint |\n| E3 | Rejected | “JSON clients normally ignore unknown fields” proves global compatibility. It does not address closed enum decoding and is contradicted by E1. | Both role revisions | Plan claim, review comments, E1 |\n| E4 | Accepted | Reconsider rollout only after server-side compatibility prevents unsupported statuses reaching Mobile v4 and a runtime/contract test verifies that guarantee—or after Mobile v4 leaves supported scope. | Both role revisions | E1–E2 |\n\nThe support window is a high-severity consequence of E1, not a separate blocker. No supplied evidence contradicts the crash test.\n\nExecution receipt: frozen `planrev-customer-api-migration-review-1`, digest `sha256:eb2be767f9e7d226bdf4ee8bb0c984b0a49bd1774dd57ec4a464c8cbe8c52819`. API Platform Engineering and Mobile Engineering both completed in wave 1 with no degradation or missing role. No files or external systems were modified."
}
