{
  "artifact_version": "1.0",
  "case_id": "design-cross-module",
  "host": "codex",
  "run_id": "codex-20260810-design-cross-module",
  "executed_at": "2026-08-10T01:01:47+08:00",
  "execution": "forward",
  "runtime_revision": "sha256:e0227e5694800774399aa6f1961b882cbc04d3910136c5e4e081d8dc2549f8ae",
  "suite_revision": "sha256:d64b046fa8fae9854e3008c9b3b55205289a93762e3a0f9cc94617619e99b8cf",
  "skill_path": "/home/sai/project/orchestrate-multi-perspective-panel",
  "prompt_sha256": "sha256:16edfc3eaf4d2fc92d0e14e51f4a4919dcc99eba0e8bf61d29d7005af70eacee",
  "output": "Recommendation: use an Order-owned, persisted process manager to coordinate the lifecycle, while Inventory, Payment, and Fulfillment remain the sole writers and sources of truth for their domains. Use the existing broker with transactional outbox/inbox delivery; do not add a workflow platform. This is a design-stage `continue`: implementation remains out of scope.\n\nThe panel used three independent lenses—domain boundaries/contracts, consistency/failure safety, and compatibility/migration/operations—because each owns a different material risk.\n\n## Responsibilities and ownership\n\n| Module | Authoritative ownership | Contract boundary |\n| --- | --- | --- |\n| Order | Order intent, lines, client idempotency records, lifecycle/process state, and read projections of downstream status | Accept order commands, drive the process, expose order status, and publish lifecycle events; it must not write stock, payment, or fulfillment records |\n| Inventory | On-hand stock, availability calculation, reservations/allocations, and stock ledger | Atomically reserve, commit, release, or expire stock; only Inventory may decide whether stock is available |\n| Payment | Authorization attempts, capture, void, refund, and provider references | Execute stable, idempotent payment operations and publish outcomes; Order interprets them but cannot rewrite them |\n| Fulfillment | Fulfillment task, progress, retry state, and completion/failure | Consume ready-for-fulfillment events durably and publish fulfillment outcomes |\n| Web/Mobile | Client request state only | Call Order APIs; never depend on domain tables or broker events |\n\nThe modules may temporarily remain in one physical database, but logical ownership starts immediately: cross-module writes go through owned interfaces, followed by write-permission fencing. Storage separation can happen later without changing the contracts.\n\n## API and event contracts\n\n- Add `POST /v2/orders` with a required `Idempotency-Key`. Scope the key to caller and operation, and persist the canonical request hash, order ID, processing state, and original response under a uniqueness constraint. Same key and payload returns the original result; key reuse with a different payload returns `409`; an in-progress retry returns a stable pending result. Updated Mobile must reuse one key for one logical order.\n- Keep the existing Web endpoint, fields, and status-code behavior compatible for two releases. Accept the idempotency header on the legacy endpoint when supplied, but do not pretend unkeyed requests have exactly-once behavior. Avoid heuristic payload deduplication because two identical orders may be legitimate.\n- Inventory exposes idempotent `Reserve`, `Commit`, and `Release` commands using stable `command_id`, `order_id`, `reservation_id`, lines, expected version, and reservation expiry. Results are `InventoryReserved`, `InventoryRejected`, `InventoryCommitted`, `InventoryReleased`, or `InventoryExpired`.\n- Payment receives a stable `authorization_attempt_id` and emits authorization, decline, capture, void, and refund outcomes. Fulfillment consumes `OrderReadyForFulfillment` with a unique `fulfillment_key = order_id` and emits started, completed, or failed outcomes.\n- Every broker message carries `message_id`, type, schema version, occurred time, aggregate ID/version, correlation ID, and causation ID. Producers atomically persist domain changes plus an outbox record. Consumers atomically persist an inbox/deduplication record plus their domain change. Delivery is explicitly at least once; schemas evolve additively until all consumers migrate.\n\n## State and failure behavior\n\nThe normal order path is:\n\n`RECEIVED -> INVENTORY_PENDING -> INVENTORY_RESERVED -> PAYMENT_PENDING -> CONFIRMING -> CONFIRMED -> FULFILLING -> COMPLETED`\n\nTerminal or exception exits include `OUT_OF_STOCK`, `PAYMENT_FAILED`, `CANCELLED`, and `REVIEW_REQUIRED`. Inventory, Payment, and Fulfillment keep separate internal state machines; the Order state is a projection of coordinated outcomes, not a substitute for their records.\n\nInventory must atomically enforce `available = on_hand - active_reservations - committed_allocations >= 0`. Only a confirmed reservation permits payment authorization. After authorization, Order commits the reservation before emitting `OrderReadyForFulfillment`. A decline or cancellation releases the reservation idempotently. If authorization arrives after reservation expiry or commit rejection, the order must not confirm; issue an idempotent void, or refund if capture already occurred, and route failed compensation to `REVIEW_REQUIRED`. Reservation expiry is a safety net, not the normal release path.\n\nTimeouts never imply rejection: retry or query with the same operation ID. Persist process step, attempt count, deadline, and last error in Order. Reconcile expired reservations, authorized-but-unconfirmed orders, confirmed-but-not-queued fulfillment, stuck compensation, outbox age, consumer lag, and dead letters. Fulfillment uses a durable subscription and inbox deduplication, replacing cursorless polling.\n\nReplace direct database incident edits with RBAC-controlled administrative commands such as retry, cancel, release, void/refund, or mark-for-review. Require operator identity, reason, incident reference, and expected version; validate transition guards and append immutable before/after audit records. Direct writes should alert immediately and routine write rights should ultimately be revoked.\n\n## Incremental migration\n\n1. **Create seams without changing behavior.** Put the existing stock check/decrement behind an Inventory-owned idempotent interface inside the current transaction. Add Order substates, version checks, idempotency storage, audit commands, and outboxes. Remove Order's direct inventory-write permission only after parity checks. There must never be two authoritative stock writers.\n2. **Fix client retry safety.** Ship Mobile idempotency-key reuse and server replay behavior. Keep legacy Web responses unchanged for the full two-release window. Start publishing broker events in shadow mode and compare them with current outcomes.\n3. **Cut over Fulfillment safely.** Capture live events from a recorded high-water mark, backfill earlier eligible order versions with deterministic IDs, and deduplicate overlap. Run the durable consumer without effects, reconcile parity and lag, then stop and fence the poller before enabling the consumer. Rollback reverses that fence; poller and consumer must never produce effects together.\n4. **Activate reservation-led coordination by cohort.** Introduce Inventory reservation first, then gate Payment on reservation and Fulfillment on confirmed inventory plus payment state. Use one effect-producing path per cohort, with shadow comparisons, replay drills, reconciliation, and bounded rollback points. Do not restore legacy writers after irreversible payment or fulfillment effects; compensate and reconcile instead.\n5. **Retire compatibility paths.** After two releases and measured client migration, remove the legacy endpoint behavior, polling, and routine database update privileges. Physical database separation is optional and can follow independently.\n\nCutover gates are operational evidence, not user approvals: zero unexplained shadow mismatches, no negative-availability invariant violations, successful replay/rollback drills, acceptable duplicate-key and inbox-deduplication behavior, bounded outbox age/consumer lag, and reconciled cross-module exception queues.\n\n## Trade-offs\n\nThis replaces one shared transaction with explicit eventual consistency, more visible pending states, reservation expiry, message deduplication, and reconciliation work. In return it gives single-writer ownership, retry safety, durable fulfillment handoff, auditable recovery, and materially stronger oversell protection. Keeping the shared database initially reduces migration risk but requires strict interface and permission enforcement; the broker removes polling loss but does not provide exactly-once execution.\n\n## Genuine decision gates\n\n1. **Customer and financial timing:** approve the reservation hold duration, when payment is authorized versus captured, and the customer-facing treatment of late authorization, expiry, void, and refund. The safe default is reserve first, authorize second, commit inventory before confirmation, and capture no earlier than the agreed business milestone.\n2. **New API acceptance semantics:** decide whether v2 returns `202` with a pending order or waits synchronously for reservation/payment confirmation. This changes the public customer experience; legacy Web semantics remain unchanged for two releases either way.\n3. **Operator authority:** decide which exceptional transitions, if any, operators may force beyond retry/cancel/compensate. Break-glass overrides change business outcomes and should require dual authorization and mandatory reconciliation.\n\nBroker technology, outbox/inbox use, domain source-of-truth boundaries, idempotency mechanics, and migration sequencing are engineering decisions within the stated constraints, not additional approval gates."
}
