{
  "artifact_version": "1.0",
  "case_id": "output-concise-no-reports",
  "host": "codex",
  "run_id": "codex-batch-0839830fe14e422ea88dfb44c0880166",
  "executed_at": "2026-08-28T13:52:43.332641Z",
  "execution": "forward",
  "runtime_revision": "sha256:1d982166ffd1151dfab36c64b1e41ee0466d6daf424679b47f02885ef7923999",
  "suite_revision": "sha256:b705d22fe72f0ac9393f19d071f0deba6fe0c78009d9d2625309e8e9ddb8c964",
  "skill_path": "/tmp/meeting-core-1d98-b705-final/cases/output-concise-no-reports/attempt-0839830fe14e422ea88dfb44c0880166/runtime/orchestrate-multi-perspective-panel",
  "prompt_sha256": "sha256:4bcacb388799c5edab30cf4482ee806616e9de72f7621a18f133e9035b2956b1",
  "output": "=== PUBLIC TURN 1/2 ===\nComplete role proposal; the panel has not run yet.\n\nRecommended seats: Architecture 1; Client Reliability 1; Operations 1.\n\n- `R1/v1` Event Architecture: Which option best preserves ownership and delivery correctness? Owns transactionality, ordering, duplicates, rollback. Evidence: option mechanics and stated constraints. Deliverable: comparative recommendation. Excludes client UX and staffing.\n- `R2/v1` Consumer Reliability: Which option preserves stable create responses and retry safety? Owns mobile compatibility, event versioning, idempotency contract. Evidence: retry and at-least-once constraints. Deliverable: compatibility assessment. Excludes infrastructure operations.\n- `R3/v1` Delivery Operations: Which option is operable and achievable within eight weeks? Owns monitoring, replay, failure recovery, rollout, approved-broker use, delivery cost. Evidence: operational requirements and deadline. Deliverable: rollout and residual-risk assessment. Excludes product-rule changes.\n\nAll roles are read-only, independent, `converge`-only, limited to the three supplied options, and must return public claims with rationale—not private reasoning or raw reports. Authority: supplied fixture only. Provenance: main-generated. Lineage: none. Role digests: unavailable in this non-persistent checkpoint.\n\nCoverage: all five criteria and constraints covered; no overlap or warnings.  \nPlan revision: `P1`; digest unavailable.\n\nReply “accept and start P1” to freeze this slate, or request role edits.\n\n=== PUBLIC TURN 2/2 ===\n**Conclusion:** Accept the **transactional outbox** for the next two releases.\n\n**Key rationale:** It atomically records order state and publication intent, preserves Order ownership, uses the approved broker, keeps Fulfillment off the create-response path, and supports versioned compatibility. Acceptance requires stable event IDs, replayable create responses, and documented Fulfillment idempotency.\n\n**Rejected options:**\n\n- **Synchronous call:** couples create success to Fulfillment availability and makes mobile retries/ambiguous failures harder to reconcile.\n- **Database polling:** a timestamp cursor alone lacks loss-free boundaries, deterministic ordering, replay, versioning, and documented idempotency.\n\n**Remaining risk:** Orders may commit while fulfillment is delayed; relay retries may duplicate events. Mitigate with backlog/lag alerts, atomic deduplication, dead-letter handling, bounded replay, schema compatibility tests, and a publisher kill switch.\n\n**Next step:** Define these conditions as release gates, then implement a staged rollout: shadow publication, canary consumption, duplicate/replay testing, and monitored expansion.\n\nEvidence ledger: `D1 accepted`—R1/v1, R2/v1, R3/v1; Option 2 and broker constraint. `D2 rejected`—all roles; Option 1/mobile retries. `D3 rejected`—all roles; Option 3/idempotency constraint. `R1 residual`—R1/v1, R3/v1; relay semantics.\n\nReceipt: frozen `P1` (digest unavailable); all three roles completed in wave 1 without degradation."
}
