{
  "artifact_version": "1.0",
  "case_id": "trigger-positive-multi-perspective",
  "host": "codex",
  "run_id": "codex-20260810-trigger-positive-installed",
  "executed_at": "2026-08-10T02:08:42+08:00",
  "execution": "forward",
  "runtime_revision": "sha256:e0227e5694800774399aa6f1961b882cbc04d3910136c5e4e081d8dc2549f8ae",
  "suite_revision": "sha256:d64b046fa8fae9854e3008c9b3b55205289a93762e3a0f9cc94617619e99b8cf",
  "skill_path": null,
  "prompt_sha256": "sha256:68afbd5f2c5090e8e633b7ec77d961ba78d9114561a5156994bc3ff7abd3fdb1",
  "output": "Recommendation: continue the design phase, but do not treat the fixture as implementation-ready yet.\n\nExecution limitation: fresh subagent capacity was unavailable, so the three perspectives were performed as explicitly separated main-session passes. The synthesis has reduced independence and is not an independent subagent-panel validation.\n\n## Synthesized design\n\nUse Order as the customer-facing lifecycle coordinator, while each module remains authoritative for its own domain:\n\n| Module | Sole authority |\n| --- | --- |\n| Order | Order identity, customer-visible lifecycle, idempotency records, orchestration state |\n| Inventory | Stock ledger, availability, reservations, expiry and consumption |\n| Payment | Authorization, capture, void and refund attempts |\n| Fulfillment | Fulfillment jobs, shipment state and consumption checkpoints |\n\nThe shared database may remain temporarily, but only one logical owner may write each domain’s data. Cross-module table updates and direct status edits are migration debt, not target contracts.\n\n```text\nClient\n  └─ idempotent Create Order → Order\n       └─ reserve → Inventory\n            └─ reservation result → Order\n                 └─ authorize → Payment\n                      └─ authorization result → Order\n                           └─ FulfillmentRequested → Fulfillment\n```\n\nEvery producer should atomically persist domain state plus an outbox record. Consumers use an inbox/deduplication record committed with their side effects. Delivery is at least once; exactly-once processing is achieved through stable identities and idempotent effects, not assumed from the broker.\n\n## Non-negotiable behavior\n\n- A customer order is not `CONFIRMED` until Inventory has an active reservation and Payment has authorized the corresponding attempt.\n- Inventory performs one atomic availability check and reservation decision. Active reservations reduce availability; fulfillment converts a reservation into consumption rather than decrementing stock again.\n- Payment failure or timeout releases the reservation.\n- A late authorization after cancellation or reservation expiry triggers an idempotent void/refund path and manual review if compensation fails.\n- Fulfillment starts only from a versioned `FulfillmentRequested` fact emitted after confirmation.\n- Duplicate and stale commands/events cannot repeat stock, payment or fulfillment side effects.\n- Arbitrary database status edits are replaced by authorized transition commands using an expected version, reason, incident reference and immutable audit record.\n\nA suitable Order state model is:\n\n| State | Required invariant | Normal exit |\n| --- | --- | --- |\n| `PENDING_INVENTORY` | Durable order and idempotency record exist | Reserved or rejected |\n| `AWAITING_PAYMENT` | Active inventory reservation exists | Confirmed or cancelled |\n| `CONFIRMED` | Reservation active and payment authorized | Fulfillment requested |\n| `FULFILLING` | Fulfillment durably accepted | Completed or exception |\n| `COMPLETED` | Fulfillment completed | Terminal |\n| `REJECTED` / `CANCELLED` | Required compensation completed | Terminal |\n| `REQUIRES_ATTENTION` | Automated recovery exhausted | Controlled operator command |\n\n## API and event contracts\n\nFor new Mobile/API traffic, require `Idempotency-Key` on `POST /orders`:\n\n- The key, canonical request hash and resulting order reference are stored atomically.\n- Same key and same payload returns the same order/result.\n- Same key with different payload returns a conflict.\n- Retention must exceed the documented client retry and incident-recovery window.\n- A retrieval endpoint lets a client resolve a timeout without submitting another logical order.\n\nExisting Web behavior should remain behind a compatibility façade for two releases. Its request shape, response shape, status codes and successful-order semantics need contract tests before migration. New fields may be additive; the legacy route must not be forced to supply an idempotency key it does not know about.\n\nEvents should include at least:\n\n- `event_id`, `event_type`, `schema_version`\n- aggregate ID and monotonic aggregate version\n- occurrence time\n- correlation and causation IDs\n\nUseful facts include `InventoryReserved`, `ReservationRejected`, `ReservationExpired`, `PaymentAuthorized`, `PaymentDeclined`, `OrderConfirmed`, `OrderCancelled`, `FulfillmentRequested` and fulfillment outcome events. Consumers must deduplicate by event ID, reject stale versions, and quarantine unsupported schemas or sequence gaps.\n\n## Safe incremental migration\n\n1. Document the ownership map, state machine, compensation matrix and legacy Web wire contract. Add reconciliation and stuck-order telemetry before changing behavior.\n2. Add the Order idempotency ledger, explicit versions and audited operational commands. Roll out idempotency-aware Mobile behavior first.\n3. Introduce an Inventory reservation façade while retaining the current database and atomic oversell protection. Do not use dual authoritative stock writers.\n4. Add transactional outbox/inbox delivery. Run Fulfillment’s event consumer in shadow mode against the existing poller and reconcile every order.\n5. Cut Fulfillment over by fenced cohort. The poller must not process the same cohort concurrently; give it a durable checkpoint only as a temporary rollback path.\n6. Move physical data ownership later, one fenced partition or write path at a time. Logical ownership does not require an immediate service/database split.\n7. After the two-release compatibility window, retire the legacy façade, polling path and routine database-write access.\n\nRollout gates should cover unbacked confirmed orders, inventory drift, duplicate side effects, outbox age, consumer lag, sequence gaps, stuck-state age, compensation failures and reconciliation mismatches.\n\n## Adjudicated decisions\n\nAccepted:\n\n- Reservation-before-confirmation.\n- Order-owned coordination with domain-owned facts.\n- Idempotent API commands and transactional outbox/inbox events.\n- Two-release Web compatibility façade.\n- Audited operational commands instead of database edits.\n- Logical boundaries before physical extraction.\n\nRejected:\n\n- Broker-only consistency assumptions.\n- Timestamp polling without a durable cursor.\n- Dual-writing inventory during migration.\n- Treating a successful network response as the idempotency mechanism.\n- Direct database status repair as a permanent incident process.\n\nProduct decisions still required before implementation are payment capture timing, reservation-expiry/customer-notification policy, and the cancellation boundary after Fulfillment has accepted work."
}
