{
  "artifact_version": "1.0",
  "case_id": "review-accounting-identity-permission",
  "host": "codex",
  "run_id": "codex-meeting-core-current2-a-WS4tNf-15999be7e28d429ab473ac4bf1c739d9",
  "executed_at": "2026-08-31T07:45:12.867198Z",
  "execution": "forward",
  "runtime_revision": "sha256:c0975717d09343fc13ce28a1e39319436acf8600ae32e35acc3815fc19cfec3e",
  "suite_revision": "sha256:e30599245cfbae3778b2f28eead99b03c36bce9a9bf140823ee405dc0fad2029",
  "skill_path": "/tmp/meeting-core-current2-a-WS4tNf/work/cases/review-accounting-identity-permission/attempt-15999be7e28d429ab473ac4bf1c739d9/runtime/orchestrate-multi-perspective-panel",
  "prompt_sha256": "sha256:ad80cf2681713262bb16afb8589cdf41563098ae90b6f1d187f0775e8e97e4b0",
  "output": "=== PUBLIC TURN 1/2 ===\nGate: pending panel execution — `awaiting_role_review`.\n\nComplexity: `critical`, due to financial-ledger integrity, authorization bypass evidence, and irreversible posting without idempotency.\n\nSeats: Accounting Controls: 1; Identity and Access Security: 1; API Reliability Engineering: 1.\n\n- **Ledger Integrity Reviewer**\n  - IDs: `role-ledger-integrity` / `role-ledger-integrity-r1`\n  - Lens: Does the draft preserve append-only semantics and auditable corrections?\n  - Owns: `risk-ledger-immutability`; policy/API reconciliation, severity, correction contract.\n  - Excludes: authorization, amount limits, implementation.\n  - Evidence: append-only policy and draft `DELETE /ledger/{entry_id}`.\n  - Deliverable: located finding, consequence, scope-safe correction, `PASS|PASS_WITH_CHANGES|FAIL`.\n  - Digest: `sha256:38d6401827d86c5761ae098b5209509a389e4b85e5a1f87652da90653f1a1a39`\n\n- **Authorization and Actor-Identity Reviewer**\n  - IDs: `role-authorization-integrity` / `role-authorization-integrity-r1`\n  - Lens: Can only a trusted `finance_approver` post, with server-derived actor identity?\n  - Owns: `risk-posting-authorization-and-identity`; role enforcement, actor spoofing, reproduced support-token behavior.\n  - Excludes: deletion semantics, idempotency, amount limits, implementation.\n  - Evidence: confirmed role policy, caller-supplied `actor_id`, missing server checks, three-of-three runtime reproduction.\n  - Deliverable: located finding, consequence, correction, verification, conclusion.\n  - Digest: `sha256:2dec5b2058a4214238dd83cb22b9c31a8f2c91c9533d75e832322729b40de11d`\n\n- **Refund API Contract and Reliability Reviewer**\n  - IDs: `role-refund-contract-reliability` / `role-refund-contract-reliability-r1`\n  - Lens: Is posting deterministic and safe under retries or ambiguous failures?\n  - Owns: `risk-duplicate-posting-and-retry`; idempotency contract and replay verification.\n  - Excludes: role-policy ownership, deletion policy, amount limits, implementation.\n  - Evidence: `POST /refunds` contract, posted-ledger side effect, absent idempotency semantics.\n  - Deliverable: contract gap, consequence, correction, tests, conclusion.\n  - Digest: `sha256:6a7906b756b6c9044f3728b771377e4c00736833d5700f6be77c70e497da7691`\n\nAll roles are main-generated, fixture-only, read-only, fresh-context reviewers. They receive no peer findings, reviewer counts, or moderator preference. Coverage is complete; overlap/import warnings: none.\n\nPlan revision: `plan-refund-readiness-r1`  \nPlan digest: `sha256:36f0456935fc26720b074b9b9c3a0c84438b80c66125b7503f2dcdb3d662347e`\n\nTo freeze this slate and run the panel:\n\n`confirm_and_start(plan-refund-readiness-r1, sha256:36f0456935fc26720b074b9b9c3a0c84438b80c66125b7503f2dcdb3d662347e)`\n\nYou may instead edit, add, remove, merge, split, or reset roles.\n\n=== PUBLIC TURN 2/2 ===\n## NO_GO — not ready for implementation\n\nThe gate is based on authoritative policy and reproducible evidence, not reviewer count.\n\n- `DELETE /ledger/{entry_id}` contradicts the append-only ledger policy. Corrections must use compensating entries. `[AIP-01]`\n- A `support_agent` can post a refund, reproduced three of three times, directly violating the authorization policy. `[AIP-02]`\n- `POST /refunds` lacks server-side role enforcement and trusts caller-supplied `actor_id`; actor identity must come from authenticated server context. `[AIP-03]`\n- The financial posting contract lacks idempotency and deterministic replay behavior, creating duplicate-posting risk. `[AIP-04]`\n- “Internal network” and “permission can be added later” are rejected as readiness arguments because they do not resolve the policy conflict or demonstrated bypass. `[AIP-05]`\n\nRequired before a fresh verification round:\n\n1. Remove ledger deletion and define append-only compensating corrections.\n2. Enforce `finance_approver` server-side; verify `support_agent` is denied without ledger mutation.\n3. Derive actor identity from authentication, not request data.\n4. Define atomic idempotency semantics and test sequential/concurrent replay and post-commit timeout cases.\n\nPublic evidence ledger:\n\n| ID | Disposition | Source role | Evidence locator |\n|---|---|---|---|\n| AIP-01 | Accepted blocker | `role-ledger-integrity-r1` | Confirmed append-only policy; draft `DELETE /ledger/{entry_id}` |\n| AIP-02 | Accepted blocker | `role-authorization-integrity-r1` | Role policy; `support_token_posts_refund`, reproduced 3/3 |\n| AIP-03 | Accepted blocker | `role-authorization-integrity-r1` | Draft `POST /refunds`: caller `actor_id`, no server role checks |\n| AIP-04 | Accepted blocker | `role-refund-contract-reliability-r1` | Draft lacks idempotency; runtime confirms durable ledger side effect |\n| AIP-05 | Rejected proposal | `role-authorization-integrity-r1` | Prior internal-network comments versus policy and runtime evidence |\n\nCompletion receipt: frozen `plan-refund-readiness-r1`, digest `sha256:36f0456935fc26720b074b9b9c3a0c84438b80c66125b7503f2dcdb3d662347e`. All three planned roles completed without degradation or missing coverage: ledger and authorization in wave 1; API reliability in wave 2. Business refund limits remained out of scope."
}
