{
  "artifact_version": "1.0",
  "case_id": "converge-conflicting-panel-advice",
  "host": "codex",
  "run_id": "8633c486-542c-4222-8165-3b4870da45b1",
  "executed_at": "2026-08-10T01:20:46+08:00",
  "execution": "forward",
  "runtime_revision": "sha256:e0227e5694800774399aa6f1961b882cbc04d3910136c5e4e081d8dc2549f8ae",
  "suite_revision": "sha256:d64b046fa8fae9854e3008c9b3b55205289a93762e3a0f9cc94617619e99b8cf",
  "skill_path": "/home/sai/project/orchestrate-multi-perspective-panel",
  "prompt_sha256": "sha256:9a64695379abe6284f3e600283d630edbe9550d3cf817394434bafe0cecceecc",
  "output": "Decision: accept the reliability engineer’s opaque-event approach, with explicit privacy, authentication, and 30-second delivery controls. It is the only supplied proposal that can satisfy both the regulatory boundary and the product timing requirement while using the platform’s existing delivery infrastructure.\n\nThe review covered three lenses: privacy/regulatory boundaries, mobile authentication and retrieval, and reliability/operating cost. Fresh subagent contexts could not be started because the platform returned `agent thread limit reached`, so these were explicit moderator lens passes with reduced independence; the decision is authority-based, not a vote.\n\n| Proposal | Outcome | Rationale |\n| --- | --- | --- |\n| Full notification body through push | rejected | It directly violates the prohibition on sending patient names or appointment reasons to a third-party push provider. Lower latency cannot override that authority. |\n| Ban push and poll every 30 seconds | rejected | The privacy concern is valid, but the remedy is broader than required. Opaque push is expressly permitted, while a 30-second polling interval leaves no margin for scheduling, network, authentication, or rendering delay and can therefore miss the 30-second requirement. |\n| Opaque event ID by push, authenticated fetch, foreground fallback | accepted | It keeps prohibited content out of the provider payload, retrieves details only after authentication, and combines the fastest existing signal with a recovery path. |\n| Lowest per-message vendor cost | rejected as the decision rule | Cost is a secondary optimization only after compliance and the 30-second requirement are met. A cheaper noncompliant or late option is not eligible. |\n\nAcceptance conditions:\n\n- Push payloads and provider-visible metadata contain only a nonsemantic, opaque event identifier and no patient name, appointment reason, or derived sensitive content.\n- The identifier conveys no authorization. Every content fetch re-authenticates as needed, checks current record-level authorization, and is safe to retry and deduplicate.\n- Authenticated foreground clients use the existing WebSocket gateway as an immediate signal; reconnect or delivery failure falls back to polling on a cadence with enough headroom for fetch and rendering to complete inside 30 seconds. Opaque push remains the background signal.\n- End-to-end telemetry measures event creation through visible status, split by push, WebSocket, and fallback path. Release is gated on demonstrating the 30-second requirement under push delay, dropped or duplicate events, reconnects, expired sessions, and fetch retries.\n- Cost is then compared on total operating cost—including polling load, battery/network use, retries, observability, and incident burden—not vendor message price alone.\n\nNo proposal is deferred or needs a user decision. The next action is to specify the opaque payload schema, authorization and deduplication contract, fallback cadence, and measurable 30-second release test, then validate them with prohibited-data scanning and failure-path tests."
}
