{
  "artifact_version": "1.0",
  "case_id": "design-mobile-api-customer",
  "host": "codex",
  "run_id": "codex-20260810-design-mobile-api-customer",
  "executed_at": "2026-08-10T01:14:53+08:00",
  "execution": "forward",
  "runtime_revision": "sha256:e0227e5694800774399aa6f1961b882cbc04d3910136c5e4e081d8dc2549f8ae",
  "suite_revision": "sha256:d64b046fa8fae9854e3008c9b3b55205289a93762e3a0f9cc94617619e99b8cf",
  "skill_path": "/home/sai/project/orchestrate-multi-perspective-panel",
  "prompt_sha256": "sha256:3676cd1a84f6ff14422ce74dd313f63dc949bbf5a0e177076d18e7261a7e66d2",
  "output": "Recommended design: treat rescheduling as one server-authoritative, atomic command—not as separate release and reserve operations. I selected three distinct lenses: appointment transaction/concurrency for the no-loss invariant, Mobile/API lifecycle for retries, offline queues, and six-month client compatibility, and end-customer experience for pending and conflict states. Fresh subagent capacity was unavailable, so these were isolated main-session passes rather than independently executed panelists; the perspective coverage is complete, but independence is reduced.\n\n### API contract\n\nKeep `POST /appointments/{id}/reschedule` with `{ \"slot_id\": 123 }`, and require:\n\n- `Idempotency-Key`: generated once when the App creates the action and persisted through every retry. Scope it to the authenticated customer and appointment. The same key plus the same normalized request returns the same terminal result and `reschedule_id`; reuse with a different target or base version returns `409 idempotency_key_conflict`.\n- `If-Match: <appointment-version>`: the version the customer acted on. A successful `200` returns the updated appointment, a new version/ETag, and `reschedule_id`. After an unknown outcome or replay, the App refreshes the appointment before presenting it as current.\n- Stable machine-readable errors: `412 appointment_version_conflict` with the authorized current appointment/version, `409 target_slot_unavailable`, `422 appointment_not_reschedulable` or `invalid_slot`, authorization/not-found responses, and retryable `429`/`5xx` responses with `Retry-After` where applicable. Clients branch on error codes, not message text.\n\n### Atomic server transition\n\nThe appointment service owns the appointment-to-slot relationship. In one transaction it authenticates the customer, verifies ownership and current rescheduling eligibility, compares the appointment version, serializes against staff edits, conditionally reserves the target under a no-double-booking constraint, then releases the old slot, updates the appointment/version, and writes the audit plus notification-outbox record. The transaction commits all of that or none of it. A target-slot race, stale appointment, validation failure, deadlock, or service error therefore leaves the original slot reserved. Staff edits must use the same versioning and serialization rules; the Mobile request must never silently overwrite them.\n\nReject release-first designs, blind retries with a new idempotency key, and automatic retry against a freshly fetched version: each can respectively lose the original booking, duplicate the command, or overwrite a staff/customer change.\n\n### App and customer flow\n\nUse explicit states: `queued_offline -> submitting -> confirmed` or `needs_attention`. While queued, submitting, or checking a timeout, show the last-known appointment as still booked and the requested slot as pending—not guaranteed. Permit cancellation while the action is still locally queued. Keep at most one unsent reschedule per appointment; if a prior submission has an unknown outcome, reconcile it with the same idempotency key before accepting another intent.\n\nOn `200`, show the confirmed new appointment immediately. On `409` or `412`, state that no requested change was made, show the current appointment, and offer refreshed availability; never resubmit automatically. On a network timeout, say the result is being checked and retry the identical command. Do not use push/email delivery as the success signal.\n\nNotification delivery starts from the committed outbox, is deduplicated by `reschedule_id`, and carries the appointment version so stale or out-of-order notifications can be suppressed. Delivery failure is observable and retryable but does not reverse a committed reschedule; the API and refreshed appointment remain authoritative.\n\n### Compatibility and operations\n\nDeploy the additive server contract first, then enable the App through a server capability/remote flag. Preserve the endpoint, error codes, idempotency records, and additive response compatibility for at least the supported six-month client window. A normal rollback hides creation of new actions while continuing to settle or safely reject existing queued commands; it must not remove the endpoint or turn retries into duplicate changes.\n\nMonitor idempotent replays, version and slot conflicts, retryable failures, App queue age, notification lag/dead letters, and reconciliation invariants (every appointment has its reserved slot; no old slot was released without a committed replacement). Keep an audit record of actor, old/new slot, before/after versions, command/result, and timestamps.\n\nOne product rule remains to be fixed before launch: the rescheduling eligibility/cutoff policy. Offline commands must be evaluated against that server-side policy when they execute and fail without mutation when no longer eligible; the client must not promise that a queued request will succeed."
}
