{
  "artifact_version": "1.0",
  "case_id": "output-concise-no-reports",
  "host": "codex",
  "run_id": "codex-meeting-core-current2-c-VGch6p-acbf0c9190274ed783d151763d86f94e",
  "executed_at": "2026-08-31T08:06:19.171769Z",
  "execution": "forward",
  "runtime_revision": "sha256:c0975717d09343fc13ce28a1e39319436acf8600ae32e35acc3815fc19cfec3e",
  "suite_revision": "sha256:e30599245cfbae3778b2f28eead99b03c36bce9a9bf140823ee405dc0fad2029",
  "skill_path": "/tmp/meeting-core-current2-c-VGch6p/work/cases/output-concise-no-reports/attempt-acbf0c9190274ed783d151763d86f94e/runtime/orchestrate-multi-perspective-panel",
  "prompt_sha256": "sha256:538d9b9363c3edd81ad8cc9b7f7ba019c6a8e02c47dd1b1930fa7f5633236084",
  "output": "=== PUBLIC TURN 1/2 ===\nConclusion: No architecture is selected yet; the required role-review/freeze checkpoint precedes independent execution.\n\nKey rationale: `converge`, `standard`: cross-service state handoff, mobile compatibility, and at-least-once recovery create distinct delivery and operational risks. Seats: Engineering 1; Operations 1.\n\n- `delivery-integrity-r1` (`delivery-integrity`; Engineering; Delivery Integrity Architect; digest `sha256:95160ba5f26da3c8c35d8e03f1b36f150dd3adb0f1a63999a5a818bee2774e4a`). Lens: preserve Order ownership and delivery correctness. Selected: transaction/event expertise. Owns: RS1 atomicity/authority, RS2 versioning/idempotency, RS3 rollback/cost. Duties: test three options; define safeguards. Excludes: new architectures, scope changes, implementation. Evidence: fixture constraints/option mechanics. Deliverable: statuses, rationale, safeguards, risks. Authority: advisory, fixture-only. Execution: read-only, fresh, independent, no-peer-input. Mode/stage: listed-options convergence only. Instruction: challenge failure windows. Provenance: main-generated; parents: none.\n\n- `fulfillment-operations-r1` (`fulfillment-operations`; Operations; Fulfillment Compatibility Operator; digest `sha256:bdd5538a73f1e58c609a08bd78e8c1ba9cb289f7a32657d82cd3eb20d565af1c`). Lens: safest consumption/operation across two releases. Selected: consumer/operational consequences. Owns: RS4 stable creates/compatibility, RS5 lag/replay/observability. Duties: assess retries, dedupe, recovery, monitoring. Excludes: Order-state writes, broker-policy changes, new architectures, implementation. Evidence/deliverable/authority/execution/mode-stage: fixture mechanics; statuses plus failure/rollout analysis; advisory, fixture-only; read-only, fresh, independent, no-peer-input; listed-options convergence. Instruction: prioritize unhappy paths. Provenance: main-generated; parents: none.\n\nRejected options: None—premature.\n\nRemaining risk: All options remain unadjudicated. Coverage complete; overlap/warnings none.\n\nPlan revision: `conv-r1`; digest `sha256:48dbaf5265078f852f2f311fc16d04856578ddfd3bd9298d4bc0cfe64f9e8f66`.\n\nNext step: `confirm_and_start(conv-r1, sha256:48dbaf5265078f852f2f311fc16d04856578ddfd3bd9298d4bc0cfe64f9e8f66)`; or adjust the slate.\n\n=== PUBLIC TURN 2/2 ===\nConclusion: Accept Option 2, transactional outbox, for the next two releases; gate: `continue`.\n\nKey rationale: It records Order state and delivery intent atomically, keeps Fulfillment off the mobile create-response path, uses the approved broker, and supplies a versioned consumer contract [I1]. This best balances correctness, compatibility, rollback isolation, operability, and achievable cost.\n\nRejected options:\n\n- Option 1, synchronous call: rejected. Idempotency could limit duplicate fulfillment, but cannot atomically couple two services; partial failures still threaten stable retries, rollback, and availability [I2].\n- Option 3, database polling: rejected as supplied. Possible lower cost is unproven, while its timestamp cursor defines no recovery, replay, deduplication, compatibility, or rollback contract [I3].\n\nRemaining risk: Outbox acceptance is conditional on documented event IDs and Fulfillment idempotency, compatible schemas, relay lag/dead-letter monitoring, replay and rollback procedures, duplicate-delivery tests, and verification of Order-create idempotency. Eight-week feasibility lacks an estimate [I4].\n\nNext step: In release 1, establish the event contract, idempotency, observability, recovery, and compatibility tests. Cut over in release 2 only after rollback and failure-path tests pass.\n\nEvidence ledger: I1 accepted—`delivery-integrity-r1,fulfillment-operations-r1`; fixture Option 2/constraints. I2 rejected—`delivery-integrity-r1`; Option 1/mobile retries. I3 rejected—`fulfillment-operations-r1`; Option 3/constraints. I4 accepted—`delivery-integrity-r1,fulfillment-operations-r1`; at-least-once/deadline clauses.\n\nReceipt: `conv-r1` / `sha256:48dbaf5265078f852f2f311fc16d04856578ddfd3bd9298d4bc0cfe64f9e8f66`; wave 1: `p-delivery-1/delivery-integrity-r1` and `p-operations-1/fulfillment-operations-r1` completed/subagent; no degradation or missing roles. Departments: Engineering for atomicity; Operations for consumer recovery."
}
