{
  "artifact_version": "1.0",
  "case_id": "platform-portable-core",
  "host": "codex",
  "run_id": "codex-20260810-portable-core",
  "executed_at": "2026-08-10T01:50:33+08:00",
  "execution": "forward",
  "runtime_revision": "sha256:e0227e5694800774399aa6f1961b882cbc04d3910136c5e4e081d8dc2549f8ae",
  "suite_revision": "sha256:d64b046fa8fae9854e3008c9b3b55205289a93762e3a0f9cc94617619e99b8cf",
  "skill_path": "/home/sai/project/orchestrate-multi-perspective-panel",
  "prompt_sha256": "sha256:ed664f53a290a320e54512f935c8b2d0ce24fc8c5fed15fc91fd125cdb3de1e9",
  "output": "Recommended design: make rescheduling one server-authoritative, atomic command while preserving `POST /appointments/{id}/reschedule`, the existing `{\"slot_id\": 123}` body, and the current `200` appointment response for the six-month compatibility window.\n\nOrchestration provenance: the shared core was executed through only the current host adapter. Three separate fresh contexts covered Mobile retry behavior, API/concurrency, and end-customer consequences; each received the same source fixture and a non-overlapping lens without peer findings. The resulting contracts and decisions below are platform-neutral.\n\n- The appointment service owns the transition and both Mobile and Web staff paths use the same reservation primitive. Within one transaction, verify authorization and appointment version, secure the target slot, update the appointment, and release the old slot only at commit. Any failure rolls back, so the original slot remains confirmed.\n- New clients create one durable idempotency key when an offline intent is queued and reuse it across relaunches, timeouts, and retries. Persist the principal, key, request fingerprint, terminal response, and one operation-keyed notification outbox record atomically. Same-key/same-request replay returns the equivalent result; conflicting reuse returns a stable conflict.\n- Return an appointment ETag/version and let new clients send it as an additive precondition. A staff-edit race returns a stable conflict with no slot mutation. Headerless legacy requests remain atomic and compatible for six months, but their inability to prove stale-intent safety is an explicit, measured limitation rather than a hidden guarantee.\n- Mobile treats queued or timed-out actions as pending, never confirmed. It retains the same key for an ambiguous retry, refreshes on appointment/slot conflicts, and continues showing the original confirmed appointment until the new one commits.\n- Notifications follow the committed outcome through a deduplicated outbox and cannot decide request success. Customer messages distinguish pending, confirmed, and failed states, reaffirm the retained appointment on failure, and use persistent accessible cues.\n\nRollout: deploy server idempotency, versioning, transactional reservation, audit, and outbox support before the new client; canary behind a feature flag; measure legacy calls, conflicts, replays, reservation rollbacks, outbox lag, duplicates, and reconciliation drift. Test response loss, offline replay, key conflicts, concurrent staff edits, target unavailability, deadlock recovery, mixed client versions, and notification replay.\n\nRemaining gates: choose the offline-intent expiry policy; accept or reject the documented legacy stale-intent limitation; and confirm that appointment plus availability share an atomic transaction. If they do not, an explicit hold/commit/compensation contract is required before implementation."
}
