{
  "artifact_version": "1.0",
  "case_id": "ideate-pure-product",
  "host": "codex",
  "run_id": "codex-batch-3868850e0db1435097b34ac089c0b4f1",
  "executed_at": "2026-08-28T12:38:59.993007Z",
  "execution": "forward",
  "runtime_revision": "sha256:1d982166ffd1151dfab36c64b1e41ee0466d6daf424679b47f02885ef7923999",
  "suite_revision": "sha256:b705d22fe72f0ac9393f19d071f0deba6fe0c78009d9d2625309e8e9ddb8c964",
  "skill_path": "/tmp/meeting-core-1d98-b705-final/cases/ideate-pure-product/attempt-3868850e0db1435097b34ac089c0b4f1/runtime/orchestrate-multi-perspective-panel",
  "prompt_sha256": "sha256:1e01480b98e91d94e210ea1c4398174ed745223e5fefa02fddb1f0249c3bc25e",
  "output": "=== PUBLIC TURN 1/2 ===\nThe ideation panel slate is ready. Mode: `ideate`; preserve divergent opportunities and select no winner.\n\nSuggested seats: Patient Advocacy 1; Clinic Operations 1; Clinical Quality 1; Health Product 1; Health IT & Privacy 1.\n\n- Patient Access Advocate (`patient-access-r1`): Which practical, emotional, financial, and accessibility barriers cause no-shows?\n  - Owns: patient circumstances, trust, equity, communication preferences.\n  - Excludes: clinic economics and technical architecture.\n  - Evidence/output: distinct patient-centered opportunities, assumptions, risks, and smallest experiments.\n\n- Small-Clinic Practice Manager (`clinic-ops-r1`): Which scheduling and workflow conditions create or amplify empty appointments?\n  - Owns: staff workload, capacity recovery, scheduling policies, operational feasibility.\n  - Excludes: clinical judgment and patient-behavior claims.\n  - Evidence/output: workflow opportunities and measurable clinic experiments.\n\n- Primary-Care Quality Lead (`clinical-quality-r1`): How can attendance improve without harming continuity, safety, or vulnerable patients?\n  - Owns: care urgency, continuity, unintended clinical consequences, ethical boundaries.\n  - Excludes: product prioritization and implementation design.\n  - Evidence/output: clinically grounded directions, safeguards, risks, and experiments.\n\n- Healthcare Product Strategist (`product-strategy-r1`): What materially different product mechanisms could prevent, predict, or recover no-shows?\n  - Owns: divergent product models, value mechanisms, adoption assumptions, test design.\n  - Excludes: choosing a winner or treating unsupported estimates as evidence.\n  - Evidence/output: a varied opportunity portfolio with discriminating experiments.\n\n- Health IT & Privacy Specialist (`health-it-privacy-r1`): Which ideas remain viable under small-clinic integration, data, consent, and delivery constraints?\n  - Owns: interoperability, messaging reliability, privacy, implementation burden.\n  - Excludes: narrowing the portfolio solely for technical convenience.\n  - Evidence/output: feasibility-aware directions and low-cost validation methods.\n\nAll roles are main-generated, read-only, independently executed, and constrained to the supplied task authority. Each must frame the target user/problem, value mechanism, key assumption, principal risk, and smallest experiment. Planned coverage is complete; no material overlap or active warnings.\n\nPlan revision: `plan-ideate-no-shows-r1`  \nDigest: unavailable because no durable meeting state may be written.\n\nYou may reply **“Use this exact slate and start”**, or adjust, add, remove, merge, split, or reset roles.\n\n=== PUBLIC TURN 2/2 ===\nNo winner was selected. The panel produced these divergent opportunities, all still hypotheses:\n\n- **O1 — Patient-controlled reminders:** preferred channel, timing, language, privacy-safe wording, plus one-tap confirm/reschedule/help. Test against standard reminders; watch delivery, completed actions, opt-outs, and privacy complaints.\n- **O2 — Barrier-resolution check-in:** discreetly identify transport, cost, caregiving, language, or accessibility barriers and route patients to available support. Test whether clinics can reliably resolve—not merely collect—reported needs.\n- **O3 — Visit-readiness and clinical context:** explain preparation and urgency, reduce anxiety, and route changing symptoms to staff review. Test one visit type; guard against alarming messages and unsafe automated triage.\n- **O4 — Flexible attendance paths:** offer eligible patients rescheduling, remote alternatives, arrival windows, or waitlist swaps. Test whether flexibility converts no-shows into completed care without creating schedule churn or inappropriate substitutions.\n- **O5 — Exception-based operations:** automate routine confirmations while giving staff one queue for nonresponses, delivery failures, and help requests. Test staff touches, early-released slots, and unresolved exceptions.\n- **O6 — Capacity recovery:** use opt-in short-notice fill lists or bounded schedule buffers to reuse cancellations. Test fill speed, staff effort, patient waiting, fairness, and unused capacity.\n- **O7 — Continuity-focused recovery:** after a miss, send nonjudgmental rebooking and preserve access to the established care team where clinically important. Test completed follow-up, repeated misses, trust, and displaced demand.\n- **O8 — Risk-guided outreach:** use transparent operational signals to prioritize *additional* help, never restrict access. First validate scores silently; compare simpler signals and audit outreach across patient groups.\n- **O9 — Commitment experiments:** explore voluntary, non-financial pledges before any deposit model. Measure trust, abandonment, subgroup effects, and cancellation timing—not attendance alone.\n\nShared guardrails: patient choice, minimal data, human review for clinical or eligibility decisions, non-punitive language, and measurement of equity, trust, staff burden, and completed care—not just raw attendance.\n\nEvidence ledger: O1 `patient-access-r1/product-strategy-r1/health-it-privacy-r1`; O2 `patient-access-r1/clinical-quality-r1`; O3 `patient-access-r1/clinical-quality-r1`; O4 `patient-access-r1/product-strategy-r1`; O5–O6 `clinic-ops-r1/health-it-privacy-r1`; O7 `clinical-quality-r1/product-strategy-r1`; O8–O9 `product-strategy-r1`, qualified by `clinical-quality-r1/health-it-privacy-r1`. Evidence consists of task-grounded assumptions and proposed discriminating pilots; no external empirical evidence was supplied.\n\nReceipt: `plan-ideate-no-shows-r1`, chat-only digest unavailable; all five role revisions completed in two independent waves with no missing or degraded perspectives."
}
