{
  "artifact_version": "1.0",
  "case_id": "converge-options",
  "host": "codex",
  "run_id": "codex-20260810-converge-options",
  "executed_at": "2026-08-10T01:07:25+08:00",
  "execution": "forward",
  "runtime_revision": "sha256:e0227e5694800774399aa6f1961b882cbc04d3910136c5e4e081d8dc2549f8ae",
  "suite_revision": "sha256:d64b046fa8fae9854e3008c9b3b55205289a93762e3a0f9cc94617619e99b8cf",
  "skill_path": "/home/sai/project/orchestrate-multi-perspective-panel",
  "prompt_sha256": "sha256:c639c28167d12e78e24aa1226d2cb618497d4ade1fe19e3f812d57b98b6c62f4",
  "output": "Decision: accept Option 2, the transactional outbox, for the next two releases. It is the only supplied option that atomically couples the Order commit to a durable delivery intent without making the create response depend on Fulfillment availability.\n\nThe panel used three independent lenses: Order API/mobile compatibility, Fulfillment delivery/idempotency, and platform operations/eight-week delivery. Their conclusions were adjudicated against the shared criteria and authorities, not by vote.\n\n| Option | Outcome | Rationale |\n| --- | --- | --- |\n| 1. Synchronous call | rejected | It couples Order latency and availability to Fulfillment. A timeout or lost response makes retries ambiguous for existing mobile clients and weakens rollback and recovery. |\n| 2. Transactional outbox | accepted | Writing the order and outbox record in one transaction closes the commit/publish gap, uses the already-approved broker, preserves Order ownership, and provides the strongest replay and operability path within eight weeks. |\n| 3. Database polling | rejected | A timestamp cursor can miss or duplicate rows around equal timestamps, late commits, precision, and pagination; it also exposes Order's storage schema as Fulfillment's contract. Existing polling may remain only as a temporary, read-only migration/rollback mechanism, not the selected architecture. |\n\nNo supplied option is deferred or needs a user decision. Workflow-engine adoption is out of scope, and no fourth architecture is needed.\n\nAcceptance conditions for Option 2:\n\n- Order atomically persists the order, the create-idempotency result, and the outbox record. Repeated mobile creates for the same idempotency key and payload return the same order identifier and equivalent response; conflicting key reuse is rejected.\n- Each versioned event includes a stable `event_id`, `order_id`, per-order monotonic version, event type/schema version, and occurrence time. Contract evolution is additive across the two-release window.\n- Fulfillment remains the sole writer of its own state and never writes Order state. It atomically commits a unique inbox/deduplication record with its side effects, treats duplicate `event_id` deliveries as success, rejects stale order versions, and quarantines unsupported versions or sequence gaps. Delivery is explicitly at least once; ordering is guaranteed only per order.\n- The relay and consumer expose outbox age, publish failures, broker/consumer lag, retries, dead letters, duplicates, quarantines, and order-to-event reconciliation. Replay and rollback procedures are documented and exercised.\n\nTwo-release action plan:\n\n1. Release 1: implement atomic outbox writes, the relay, versioned event contract, Fulfillment inbox/idempotency, replay tests, dashboards, alerts, dead-letter handling, and reconciliation. Run the event path in shadow mode without fulfillment side effects while the existing read-only poller remains authoritative.\n2. Release 2: canary event-driven fulfillment, fence the poller before enabling event side effects for each cohort, then expand only while reconciliation shows no missing events, redelivery tests show zero duplicate side effects, and lag/error thresholds hold. Roll back by disabling event effects, restoring the poller from a recorded checkpoint, and reconciling any overlap; keep outbox records for audit and replay.\n\nThe next action is to assign owners and numeric service thresholds for relay age, consumer lag, reconciliation mismatch, and rollback time, then begin Release 1."
}
